"Term","Overlap","P.value","Adjusted.P.value","Old.P.value","Old.Adjusted.P.value","Odds.Ratio","Combined.Score","Genes"
"DNA Damage Response, Signal Transduction By P53 Class Mediator Resulting In Cell Cycle Arrest (GO:0006977)","1/17",0.302984086138668,0.634047933120851,0,0,2.91825775656325,3.48461861854739,"MDM2"
"DNA Modification (GO:0006304)","1/17",0.302984086138668,0.634047933120851,0,0,2.91825775656325,3.48461861854739,"SMUG1"
"Golgi To Vacuole Transport (GO:0006896)","1/17",0.302984086138668,0.634047933120851,0,0,2.91825775656325,3.48461861854739,"AP1G2"
"NAD Biosynthetic Process (GO:0009435)","1/17",0.302984086138668,0.634047933120851,0,0,2.91825775656325,3.48461861854739,"NADSYN1"
"Regulation Of Glucose Transmembrane Transport (GO:0010827)","1/17",0.302984086138668,0.634047933120851,0,0,2.91825775656325,3.48461861854739,"TRIB3"
"Regulation Of Hematopoietic Progenitor Cell Differentiation (GO:1901532)","1/17",0.302984086138668,0.634047933120851,0,0,2.91825775656325,3.48461861854739,"METTL3"
"Rac Protein Signal Transduction (GO:0016601)","1/17",0.302984086138668,0.634047933120851,0,0,2.91825775656325,3.48461861854739,"GARRE1"
"Regulation Of Leukocyte Chemotaxis (GO:0002688)","1/17",0.302984086138668,0.634047933120851,0,0,2.91825775656325,3.48461861854739,"SLC8B1"
"Aorta Morphogenesis (GO:0035909)","1/17",0.302984086138668,0.634047933120851,0,0,2.91825775656325,3.48461861854739,"TFAP2B"
"Base Conversion Or Substitution Editing (GO:0016553)","1/17",0.302984086138668,0.634047933120851,0,0,2.91825775656325,3.48461861854739,"METTL3"
"Branched-Chain Amino Acid Catabolic Process (GO:0009083)","1/17",0.302984086138668,0.634047933120851,0,0,2.91825775656325,3.48461861854739,"BCKDHB"
"Regulation Of Receptor Signaling Pathway Via STAT (GO:1904892)","1/17",0.302984086138668,0.634047933120851,0,0,2.91825775656325,3.48461861854739,"MST1"
"Central Nervous System Neuron Development (GO:0021954)","1/17",0.302984086138668,0.634047933120851,0,0,2.91825775656325,3.48461861854739,"MAPT"
"Diol Biosynthetic Process (GO:0034312)","1/17",0.302984086138668,0.634047933120851,0,0,2.91825775656325,3.48461861854739,"SPTSSB"
"Embryonic Axis Specification (GO:0000578)","1/17",0.302984086138668,0.634047933120851,0,0,2.91825775656325,3.48461861854739,"TBX3"
"Embryonic Digit Morphogenesis (GO:0042733)","1/17",0.302984086138668,0.634047933120851,0,0,2.91825775656325,3.48461861854739,"TBX3"
"Toll-Like Receptor 4 Signaling Pathway (GO:0034142)","1/17",0.302984086138668,0.634047933120851,0,0,2.91825775656325,3.48461861854739,"TRIL"
"Intracellular Estrogen Receptor Signaling Pathway (GO:0030520)","1/17",0.302984086138668,0.634047933120851,0,0,2.91825775656325,3.48461861854739,"ESR1"
"Keratan Sulfate Metabolic Process (GO:0042339)","1/17",0.302984086138668,0.634047933120851,0,0,2.91825775656325,3.48461861854739,"CHST1"
"Microtubule Depolymerization (GO:0007019)","1/17",0.302984086138668,0.634047933120851,0,0,2.91825775656325,3.48461861854739,"STMND1"
"Motile Cilium Assembly (GO:0044458)","1/17",0.302984086138668,0.634047933120851,0,0,2.91825775656325,3.48461861854739,"BBOF1"
"Negative Regulation Of Rho Protein Signal Transduction (GO:0035024)","1/17",0.302984086138668,0.634047933120851,0,0,2.91825775656325,3.48461861854739,"ITGA3"
"Negative Regulation Of Insulin Secretion (GO:0046676)","1/17",0.302984086138668,0.634047933120851,0,0,2.91825775656325,3.48461861854739,"IRS1"
"Negative Regulation Of Vascular Associated Smooth Muscle Cell Proliferation (GO:1904706)","1/17",0.302984086138668,0.634047933120851,0,0,2.91825775656325,3.48461861854739,"TGFB3"
"Nicotinamide Nucleotide Metabolic Process (GO:0046496)","1/17",0.302984086138668,0.634047933120851,0,0,2.91825775656325,3.48461861854739,"GPD1L"
"Peptidyl-Threonine Dephosphorylation (GO:0035970)","1/17",0.302984086138668,0.634047933120851,0,0,2.91825775656325,3.48461861854739,"PDP1"
"Positive Regulation Of SMAD Protein Signal Transduction (GO:0060391)","1/17",0.302984086138668,0.634047933120851,0,0,2.91825775656325,3.48461861854739,"TGFB3"
"Positive Regulation Of Amyloid-Beta Formation (GO:1902004)","1/17",0.302984086138668,0.634047933120851,0,0,2.91825775656325,3.48461861854739,"ABCG1"
"Positive Regulation Of Cartilage Development (GO:0061036)","1/17",0.302984086138668,0.634047933120851,0,0,2.91825775656325,3.48461861854739,"TAPT1"
"Positive Regulation Of Dendrite Extension (GO:1903861)","1/17",0.302984086138668,0.634047933120851,0,0,2.91825775656325,3.48461861854739,"NEDD4L"
"Positive Regulation Of Lymphocyte Chemotaxis (GO:0140131)","1/17",0.302984086138668,0.634047933120851,0,0,2.91825775656325,3.48461861854739,"STK39"
"Positive Regulation Of Macrophage Derived Foam Cell Differentiation (GO:0010744)","1/17",0.302984086138668,0.634047933120851,0,0,2.91825775656325,3.48461861854739,"PRKCH"
"Positive Regulation Of Stem Cell Differentiation (GO:2000738)","1/17",0.302984086138668,0.634047933120851,0,0,2.91825775656325,3.48461861854739,"SP7"
"Regulation Of Adenylate Cyclase Activity (GO:0045761)","1/17",0.302984086138668,0.634047933120851,0,0,2.91825775656325,3.48461861854739,"LTB4R2"
"Positive Regulation Of DNA-templated Transcription (GO:0045893)","29/1243",0.304597459487108,0.636695718173623,0,0,1.12206272094111,1.33386796929619,"KMT2D;CRTC1;FOXI1;FOXK1;ZNF24;ASCL2;NPAS2;NEUROD1;HELZ2;IFNL1;SIX4;ERBB4;HIVEP1;RIPK1;TFAP2B;FZD4;TGFB3;ZFX;ESR1;TBX3;KAT2A;ZNF516;SP6;HOXB2;SP7;LMX1B;SSBP2;TAF4;PAXBP1"
"Actin Polymerization Or Depolymerization (GO:0008154)","2/53",0.3062005765672,0.638587063331138,0,0,1.83216061544235,2.16838941099244,"SVIL;MSRB2"
"Tight Junction Assembly (GO:0120192)","2/53",0.3062005765672,0.638587063331138,0,0,1.83216061544235,2.16838941099244,"POF1B;OCEL1"
"Regulation Of Exocytosis (GO:0017157)","2/54",0.313963815630509,0.639111453511486,0,0,1.79683474420317,2.08159268806931,"RAB3A;RAB26"
"Apical Junction Assembly (GO:0043297)","2/54",0.313963815630509,0.639111453511486,0,0,1.79683474420317,2.08159268806931,"POF1B;OCEL1"
"Ribosomal Large Subunit Biogenesis (GO:0042273)","2/54",0.313963815630509,0.639111453511486,0,0,1.79683474420317,2.08159268806931,"PPAN;RRP15"
"Regulation Of Blood Vessel Endothelial Cell Migration (GO:0043535)","2/54",0.313963815630509,0.639111453511486,0,0,1.79683474420317,2.08159268806931,"PDPK1;FGFR1"
"Sphingolipid Metabolic Process (GO:0006665)","3/94",0.316169526559912,0.639111453511486,0,0,1.54075420981896,1.77414262355763,"SPTSSB;DEGS2;CLN8"
"Vesicle Organization (GO:0016050)","3/94",0.316169526559912,0.639111453511486,0,0,1.54075420981896,1.77414262355763,"ZFYVE16;VAMP1;SNX11"
"Regulation Of Collagen Biosynthetic Process (GO:0032965)","1/18",0.317633849776895,0.639111453511486,0,0,2.74645514530394,3.14978849452235,"TGFB3"
"Regulation Of Dendrite Extension (GO:1903859)","1/18",0.317633849776895,0.639111453511486,0,0,2.74645514530394,3.14978849452235,"NEDD4L"
"Regulation Of Histone Modification (GO:0031056)","1/18",0.317633849776895,0.639111453511486,0,0,2.74645514530394,3.14978849452235,"KAT2A"
"T-helper Cell Differentiation (GO:0042093)","1/18",0.317633849776895,0.639111453511486,0,0,2.74645514530394,3.14978849452235,"FOXP1"
"Actin Filament Capping (GO:0051693)","1/18",0.317633849776895,0.639111453511486,0,0,2.74645514530394,3.14978849452235,"SVIL"
"Regulation Of Lymphocyte Activation (GO:0051249)","1/18",0.317633849776895,0.639111453511486,0,0,2.74645514530394,3.14978849452235,"KAT2A"
"Barbed-End Actin Filament Capping (GO:0051016)","1/18",0.317633849776895,0.639111453511486,0,0,2.74645514530394,3.14978849452235,"SVIL"
"Response To Organophosphorus (GO:0046683)","1/18",0.317633849776895,0.639111453511486,0,0,2.74645514530394,3.14978849452235,"DGKQ"
"Energy Reserve Metabolic Process (GO:0006112)","1/18",0.317633849776895,0.639111453511486,0,0,2.74645514530394,3.14978849452235,"PPP1R3C"
"Epithelial Cell Development (GO:0002064)","1/18",0.317633849776895,0.639111453511486,0,0,2.74645514530394,3.14978849452235,"POF1B"
"Vesicle-Mediated Transport In Synapse (GO:0099003)","1/18",0.317633849776895,0.639111453511486,0,0,2.74645514530394,3.14978849452235,"RAB3A"
"Intracellular Lipid Transport (GO:0032365)","1/18",0.317633849776895,0.639111453511486,0,0,2.74645514530394,3.14978849452235,"CPT1B"
"Melanosome Localization (GO:0032400)","1/18",0.317633849776895,0.639111453511486,0,0,2.74645514530394,3.14978849452235,"MREG"
"Negative Regulation Of DNA-templated Transcription, Elongation (GO:0032785)","1/18",0.317633849776895,0.639111453511486,0,0,2.74645514530394,3.14978849452235,"HEXIM1"
"Negative Regulation Of Lipid Catabolic Process (GO:0050995)","1/18",0.317633849776895,0.639111453511486,0,0,2.74645514530394,3.14978849452235,"CIDEC"
"Negative Regulation Of Lipid Storage (GO:0010888)","1/18",0.317633849776895,0.639111453511486,0,0,2.74645514530394,3.14978849452235,"ABCG1"
"Negative Regulation Of Peptide Hormone Secretion (GO:0090278)","1/18",0.317633849776895,0.639111453511486,0,0,2.74645514530394,3.14978849452235,"IRS1"
"Negative Regulation Of Signal Transduction By P53 Class Mediator (GO:1901797)","1/18",0.317633849776895,0.639111453511486,0,0,2.74645514530394,3.14978849452235,"MDM2"
"Neural Crest Cell Differentiation (GO:0014033)","1/18",0.317633849776895,0.639111453511486,0,0,2.74645514530394,3.14978849452235,"TAPT1"
"Nitric Oxide Mediated Signal Transduction (GO:0007263)","1/18",0.317633849776895,0.639111453511486,0,0,2.74645514530394,3.14978849452235,"NEUROD1"
"Positive Regulation Of CREB Transcription Factor Activity (GO:0032793)","1/18",0.317633849776895,0.639111453511486,0,0,2.74645514530394,3.14978849452235,"CRTC1"
"Positive Regulation Of Cytokine Production Involved In Inflammatory Response (GO:1900017)","1/18",0.317633849776895,0.639111453511486,0,0,2.74645514530394,3.14978849452235,"CARD9"
"Positive Regulation Of Epidermal Cell Differentiation (GO:0045606)","1/18",0.317633849776895,0.639111453511486,0,0,2.74645514530394,3.14978849452235,"PRKCH"
"Protein Autoprocessing (GO:0016540)","1/18",0.317633849776895,0.639111453511486,0,0,2.74645514530394,3.14978849452235,"FAM111A"
"Regulation Of DNA Damage Checkpoint (GO:2000001)","1/18",0.317633849776895,0.639111453511486,0,0,2.74645514530394,3.14978849452235,"RPA2"
"Regulation Of Cell Cycle G2/M Phase Transition (GO:1902749)","1/18",0.317633849776895,0.639111453511486,0,0,2.74645514530394,3.14978849452235,"CDK3"
"Cellular Response To Fibroblast Growth Factor Stimulus (GO:0044344)","2/55",0.3217077703695,0.641844482277271,0,0,1.76284192470886,1.99925963609635,"FGFR4;FGFR1"
"Neuron Migration (GO:0001764)","2/55",0.3217077703695,0.641844482277271,0,0,1.76284192470886,1.99925963609635,"KIAA0319L;FGFR1"
"Protein Localization To Organelle (GO:0033365)","4/137",0.324818841714459,0.641844482277271,0,0,1.40594274146906,1.58096526650297,"SIX4;TOLLIP;MDM2;RPA2"
"Positive Regulation Of Transcription By RNA Polymerase II (GO:0045944)","22/938",0.327092564955299,0.641844482277271,0,0,1.12628645410458,1.25863871224102,"KMT2D;TFAP2B;CRTC1;TGFB3;FOXI1;ZNF24;ASCL2;ZFX;ESR1;TBX3;NEUROD1;HELZ2;KAT2A;SP6;HIVEP1;HOXB2;RIPK1;SP7;LMX1B;SSBP2;TAF4;PAXBP1"
"RNA Polymerase II Preinitiation Complex Assembly (GO:0051123)","2/56",0.329429831283776,0.641844482277271,0,0,1.73010809852915,1.92109802366274,"TAF4;ESR1"
"Regulation Of Reactive Oxygen Species Metabolic Process (GO:2000377)","2/56",0.329429831283776,0.641844482277271,0,0,1.73010809852915,1.92109802366274,"NOXA1;RIPK1"
"Regulation Of Centriole Replication (GO:0046599)","1/19",0.331976424403662,0.641844482277271,0,0,2.59374171307346,2.86009648219702,"KAT2A"
"N-glycan Processing (GO:0006491)","1/19",0.331976424403662,0.641844482277271,0,0,2.59374171307346,2.86009648219702,"MGAT4A"
"RNA Destabilization (GO:0050779)","1/19",0.331976424403662,0.641844482277271,0,0,2.59374171307346,2.86009648219702,"METTL3"
"Regulation Of Lymphocyte Differentiation (GO:0045619)","1/19",0.331976424403662,0.641844482277271,0,0,2.59374171307346,2.86009648219702,"METTL3"
"Regulation Of Megakaryocyte Differentiation (GO:0045652)","1/19",0.331976424403662,0.641844482277271,0,0,2.59374171307346,2.86009648219702,"L3MBTL1"
"Regulation Of Nuclear Division (GO:0051783)","1/19",0.331976424403662,0.641844482277271,0,0,2.59374171307346,2.86009648219702,"L3MBTL1"
"Cardiac Epithelial To Mesenchymal Transition (GO:0060317)","1/19",0.331976424403662,0.641844482277271,0,0,2.59374171307346,2.86009648219702,"TBX3"
"Regulation Of Transcription Involved In G1/S Transition Of Mitotic Cell Cycle (GO:0000083)","1/19",0.331976424403662,0.641844482277271,0,0,2.59374171307346,2.86009648219702,"CDK17"
"Chondroitin Sulfate Proteoglycan Biosynthetic Process (GO:0050650)","1/19",0.331976424403662,0.641844482277271,0,0,2.59374171307346,2.86009648219702,"CHPF2"
"Response To Fatty Acid (GO:0070542)","1/19",0.331976424403662,0.641844482277271,0,0,2.59374171307346,2.86009648219702,"IRS1"
"Dopaminergic Neuron Differentiation (GO:0071542)","1/19",0.331976424403662,0.641844482277271,0,0,2.59374171307346,2.86009648219702,"LMX1B"
"Skeletal Muscle Contraction (GO:0003009)","1/19",0.331976424403662,0.641844482277271,0,0,2.59374171307346,2.86009648219702,"TNNT1"
"Sphingosine Metabolic Process (GO:0006670)","1/19",0.331976424403662,0.641844482277271,0,0,2.59374171307346,2.86009648219702,"SPTSSB"
"Steroid Hormone Biosynthetic Process (GO:0120178)","1/19",0.331976424403662,0.641844482277271,0,0,2.59374171307346,2.86009648219702,"HSD17B8"
"Establishment Of Epithelial Cell Polarity (GO:0090162)","1/19",0.331976424403662,0.641844482277271,0,0,2.59374171307346,2.86009648219702,"SYNE4"
"Establishment Of Skin Barrier (GO:0061436)","1/19",0.331976424403662,0.641844482277271,0,0,2.59374171307346,2.86009648219702,"FGFR1"
"Superoxide Anion Generation (GO:0042554)","1/19",0.331976424403662,0.641844482277271,0,0,2.59374171307346,2.86009648219702,"NOXA1"
"Fluid Transport (GO:0042044)","1/19",0.331976424403662,0.641844482277271,0,0,2.59374171307346,2.86009648219702,"UPK3A"
"Glycogen Metabolic Process (GO:0005977)","1/19",0.331976424403662,0.641844482277271,0,0,2.59374171307346,2.86009648219702,"PPP1R3C"
"Water Transport (GO:0006833)","1/19",0.331976424403662,0.641844482277271,0,0,2.59374171307346,2.86009648219702,"UPK3A"
"Interleukin-1-Mediated Signaling Pathway (GO:0070498)","1/19",0.331976424403662,0.641844482277271,0,0,2.59374171307346,2.86009648219702,"TOLLIP"
"Leukotriene Biosynthetic Process (GO:0019370)","1/19",0.331976424403662,0.641844482277271,0,0,2.59374171307346,2.86009648219702,"GGT6"
"Mesoderm Development (GO:0007498)","1/19",0.331976424403662,0.641844482277271,0,0,2.59374171307346,2.86009648219702,"TBX3"
"Negative Regulation Of Cyclin-Dependent Protein Serine/Threonine Kinase Activity (GO:0045736)","1/19",0.331976424403662,0.641844482277271,0,0,2.59374171307346,2.86009648219702,"HEXIM1"
"Negative Regulation Of Fatty Acid Metabolic Process (GO:0045922)","1/19",0.331976424403662,0.641844482277271,0,0,2.59374171307346,2.86009648219702,"TRIB3"
"Phosphatidylcholine Biosynthetic Process (GO:0006656)","1/19",0.331976424403662,0.641844482277271,0,0,2.59374171307346,2.86009648219702,"SLC44A4"
"Positive Regulation Of Axon Extension (GO:0045773)","1/19",0.331976424403662,0.641844482277271,0,0,2.59374171307346,2.86009648219702,"MAPT"
"Positive Regulation Of calcineurin-NFAT Signaling Cascade (GO:0070886)","1/19",0.331976424403662,0.641844482277271,0,0,2.59374171307346,2.86009648219702,"LMCD1"
"Positive Regulation Of Calcineurin-Mediated Signaling (GO:0106058)","1/19",0.331976424403662,0.641844482277271,0,0,2.59374171307346,2.86009648219702,"LMCD1"
"Protein Heterooligomerization (GO:0051291)","1/19",0.331976424403662,0.641844482277271,0,0,2.59374171307346,2.86009648219702,"HSD17B8"
"Regulation Of B Cell Differentiation (GO:0045577)","1/19",0.331976424403662,0.641844482277271,0,0,2.59374171307346,2.86009648219702,"INHA"
"Membrane Lipid Biosynthetic Process (GO:0046467)","2/57",0.33712750645046,0.644467774070816,0,0,1.69856459330144,1.84683919752651,"SPTSSB;DEGS2"
"Positive Regulation Of Apoptotic Process (GO:0043065)","7/270",0.339901210640827,0.644467774070816,0,0,1.24489269833086,1.34336403510138,"NEUROD1;ING5;MOAP1;TFAP2B;TGFB3;RIPK1;GADD45G"
"Regulation Of Cell Growth (GO:0001558)","6/227",0.342531172372129,0.644467774070816,0,0,1.26952587054889,1.36016063742851,"PABIR1;ING5;SLC44A4;TAOK2;LTBP4;CGRRF1"
"Phosphate-Containing Compound Metabolic Process (GO:0006796)","5/184",0.344177950349205,0.644467774070816,0,0,1.30584909470283,1.39281401887607,"PIP4P1;TOLLIP;IPMK;INPP5J;CLN8"
"Renal System Development (GO:0072001)","2/58",0.344798417819882,0.644467774070816,0,0,1.66814764183185,1.7762358169257,"TFAP2B;IFT27"
"Glycosaminoglycan Biosynthetic Process (GO:0006024)","2/58",0.344798417819882,0.644467774070816,0,0,1.66814764183185,1.7762358169257,"CHPF2;CHST1"
"Memory (GO:0007613)","2/58",0.344798417819882,0.644467774070816,0,0,1.66814764183185,1.7762358169257,"KAT2A;MAPT"
"Peptidyl-Threonine Phosphorylation (GO:0018107)","2/58",0.344798417819882,0.644467774070816,0,0,1.66814764183185,1.7762358169257,"PDPK1;STK39"
"DNA Unwinding Involved In DNA Replication (GO:0006268)","1/20",0.346018236269842,0.644467774070816,0,0,2.45710337897249,2.60763486731768,"PURA"
"Regulation Of Fibroblast Migration (GO:0010762)","1/20",0.346018236269842,0.644467774070816,0,0,2.45710337897249,2.60763486731768,"MACIR"
"T Cell Mediated Immunity (GO:0002456)","1/20",0.346018236269842,0.644467774070816,0,0,2.45710337897249,2.60763486731768,"CR1L"
"Activation Of Adenylate Cyclase Activity (GO:0007190)","1/20",0.346018236269842,0.644467774070816,0,0,2.45710337897249,2.60763486731768,"PRSS8"
"Anterior/Posterior Axis Specification (GO:0009948)","1/20",0.346018236269842,0.644467774070816,0,0,2.45710337897249,2.60763486731768,"TBX3"
"Regulation Of Necroptotic Process (GO:0060544)","1/20",0.346018236269842,0.644467774070816,0,0,2.45710337897249,2.60763486731768,"RIPK1"
"Cellular Response To Estradiol Stimulus (GO:0071392)","1/20",0.346018236269842,0.644467774070816,0,0,2.45710337897249,2.60763486731768,"ESR1"
"Response To ATP (GO:0033198)","1/20",0.346018236269842,0.644467774070816,0,0,2.45710337897249,2.60763486731768,"DGKQ"
"Response To Ketone (GO:1901654)","1/20",0.346018236269842,0.644467774070816,0,0,2.45710337897249,2.60763486731768,"TGFB3"
"Stress-Activated Protein Kinase Signaling Cascade (GO:0031098)","1/20",0.346018236269842,0.644467774070816,0,0,2.45710337897249,2.60763486731768,"TAOK2"
"Sulfur Compound Catabolic Process (GO:0044273)","1/20",0.346018236269842,0.644467774070816,0,0,2.45710337897249,2.60763486731768,"IDUA"
"Glutamate Metabolic Process (GO:0006536)","1/20",0.346018236269842,0.644467774070816,0,0,2.45710337897249,2.60763486731768,"DGLUCY"
"Xenobiotic Transport (GO:0042908)","1/20",0.346018236269842,0.644467774070816,0,0,2.45710337897249,2.60763486731768,"ABCC3"
"Long-Term Memory (GO:0007616)","1/20",0.346018236269842,0.644467774070816,0,0,2.45710337897249,2.60763486731768,"KAT2A"
"Maturation Of LSU-rRNA (GO:0000470)","1/20",0.346018236269842,0.644467774070816,0,0,2.45710337897249,2.60763486731768,"RRP15"
"Mesoderm Formation (GO:0001707)","1/20",0.346018236269842,0.644467774070816,0,0,2.45710337897249,2.60763486731768,"ITGA3"
"Microglial Cell Activation (GO:0001774)","1/20",0.346018236269842,0.644467774070816,0,0,2.45710337897249,2.60763486731768,"MAPT"
"Monocarboxylic Acid Catabolic Process (GO:0072329)","1/20",0.346018236269842,0.644467774070816,0,0,2.45710337897249,2.60763486731768,"IDUA"
"Negative Regulation Of B Cell Activation (GO:0050869)","1/20",0.346018236269842,0.644467774070816,0,0,2.45710337897249,2.60763486731768,"INHA"
"Negative Regulation Of Cyclin-Dependent Protein Kinase Activity (GO:1904030)","1/20",0.346018236269842,0.644467774070816,0,0,2.45710337897249,2.60763486731768,"HEXIM1"
"Negative Regulation Of Cytokine Production Involved In Inflammatory Response (GO:1900016)","1/20",0.346018236269842,0.644467774070816,0,0,2.45710337897249,2.60763486731768,"MACIR"
"Negative Regulation Of miRNA Transcription (GO:1902894)","1/20",0.346018236269842,0.644467774070816,0,0,2.45710337897249,2.60763486731768,"ESR1"
"Negative Regulation Of Phosphate Metabolic Process (GO:0045936)","1/20",0.346018236269842,0.644467774070816,0,0,2.45710337897249,2.60763486731768,"INHA"
"Nuclear-Transcribed mRNA poly(A) Tail Shortening (GO:0000289)","1/20",0.346018236269842,0.644467774070816,0,0,2.45710337897249,2.60763486731768,"TUT7"
"Positive Regulation Of Lipid Catabolic Process (GO:0050996)","1/20",0.346018236269842,0.644467774070816,0,0,2.45710337897249,2.60763486731768,"IRS1"
"Positive Regulation Of Lipid Storage (GO:0010884)","1/20",0.346018236269842,0.644467774070816,0,0,2.45710337897249,2.60763486731768,"OSBPL11"
"Protein Deacylation (GO:0035601)","1/20",0.346018236269842,0.644467774070816,0,0,2.45710337897249,2.60763486731768,"SIRT3"
"Regulation Of Cardiac Muscle Cell Proliferation (GO:0060043)","1/20",0.346018236269842,0.644467774070816,0,0,2.45710337897249,2.60763486731768,"ERBB4"
"Response To UV (GO:0009411)","3/100",0.350699720413942,0.646889243074437,0,0,1.44500482088556,1.51411205948455,"TP53I13;UVSSA;METTL3"
"ncRNA Processing (GO:0034470)","3/100",0.350699720413942,0.646889243074437,0,0,1.44500482088556,1.51411205948455,"INTS2;NOL8;INTS6"
"DNA-templated Transcription Initiation (GO:0006352)","2/59",0.352440297423918,0.646889243074437,0,0,1.63879795181734,1.709059840894,"TAF4;GTF2E1"
"Aerobic Respiration (GO:0009060)","2/59",0.352440297423918,0.646889243074437,0,0,1.63879795181734,1.709059840894,"MTFR1L;SIRT3"
"Regulation Of Multicellular Organismal Development (GO:2000026)","2/59",0.352440297423918,0.646889243074437,0,0,1.63879795181734,1.709059840894,"ING5;KAT2A"
"Transcription Preinitiation Complex Assembly (GO:0070897)","2/59",0.352440297423918,0.646889243074437,0,0,1.63879795181734,1.709059840894,"TAF4;ESR1"
"Microtubule Cytoskeleton Organization Involved In Mitosis (GO:1902850)","2/59",0.352440297423918,0.646889243074437,0,0,1.63879795181734,1.709059840894,"TUBG2;PCNT"
"Negative Regulation Of Macromolecule Metabolic Process (GO:0010605)","5/186",0.352493521218459,0.646889243074437,0,0,1.29128669373627,1.34645438218249,"TIPARP;DGKQ;MAPT;ESR1;FOXP1"
"Proteasome-Mediated Ubiquitin-Dependent Protein Catabolic Process (GO:0043161)","8/319",0.355660823900197,0.646889243074437,0,0,1.20307183217307,1.24370888469081,"TRIM3;MDM2;NEDD4L;UBR3;KCTD2;FBXL4;ANAPC2;FBXL12"
"Protein Modification By Small Protein Conjugation (GO:0032446)","9/364",0.356870798619409,0.646889243074437,0,0,1.18587437030945,1.2219029784995,"ARRDC4;RNF43;TRIM62;UVSSA;MDM2;NEDD4L;UBR3;DTX2;RNF152"
"Positive Regulation Of Phosphorylation (GO:0042327)","6/231",0.357450946070266,0.646889243074437,0,0,1.24669887278583,1.28255036687347,"DHX34;ERBB4;RIPK1;FGFR4;CARD14;FGFR1"
"DNA Replication Initiation (GO:0006270)","1/21",0.359765577709914,0.646889243074437,0,0,2.33412887828162,2.38618609724726,"PURA"
"Regulation Of Histone Deacetylation (GO:0031063)","1/21",0.359765577709914,0.646889243074437,0,0,2.33412887828162,2.38618609724726,"KAT2A"
"Anaphase-Promoting Complex-Dependent Catabolic Process (GO:0031145)","1/21",0.359765577709914,0.646889243074437,0,0,2.33412887828162,2.38618609724726,"ANAPC2"
"Regulation Of Transferase Activity (GO:0051338)","1/21",0.359765577709914,0.646889243074437,0,0,2.33412887828162,2.38618609724726,"SPTSSB"
"Cellular Response To Nerve Growth Factor Stimulus (GO:1990090)","1/21",0.359765577709914,0.646889243074437,0,0,2.33412887828162,2.38618609724726,"MAPT"
"Skin Epidermis Development (GO:0098773)","1/21",0.359765577709914,0.646889243074437,0,0,2.33412887828162,2.38618609724726,"FGFR1"
"Sulfur Compound Transport (GO:0072348)","1/21",0.359765577709914,0.646889243074437,0,0,2.33412887828162,2.38618609724726,"SLC19A2"
"Focal Adhesion Assembly (GO:0048041)","1/21",0.359765577709914,0.646889243074437,0,0,2.33412887828162,2.38618609724726,"TAOK2"
"Innate Immune Response In Mucosa (GO:0002227)","1/21",0.359765577709914,0.646889243074437,0,0,2.33412887828162,2.38618609724726,"BPIFB1"
"Maturation Of 5.8S rRNA From Tricistronic rRNA Transcript (SSU-rRNA, 5.8S rRNA, LSU-rRNA) (GO:0000466)","1/21",0.359765577709914,0.646889243074437,0,0,2.33412887828162,2.38618609724726,"LTB4R2"
"Mitochondrial Calcium Ion Homeostasis (GO:0051560)","1/21",0.359765577709914,0.646889243074437,0,0,2.33412887828162,2.38618609724726,"SLC8B1"
"Modulation By Symbiont Of Entry Into Host (GO:0052372)","1/21",0.359765577709914,0.646889243074437,0,0,2.33412887828162,2.38618609724726,"TRIM62"
"Negative Regulation Of GTPase Activity (GO:0034260)","1/21",0.359765577709914,0.646889243074437,0,0,2.33412887828162,2.38618609724726,"CPEB2"
"Negative Regulation Of miRNA Metabolic Process (GO:2000629)","1/21",0.359765577709914,0.646889243074437,0,0,2.33412887828162,2.38618609724726,"ESR1"
"Negative Regulation Of Osteoclast Differentiation (GO:0045671)","1/21",0.359765577709914,0.646889243074437,0,0,2.33412887828162,2.38618609724726,"GPR137B"
"Peptide Catabolic Process (GO:0043171)","1/21",0.359765577709914,0.646889243074437,0,0,2.33412887828162,2.38618609724726,"LNPEP"
"Plasma Membrane Repair (GO:0001778)","1/21",0.359765577709914,0.646889243074437,0,0,2.33412887828162,2.38618609724726,"RAB3A"
"poly(A)+ mRNA Export From Nucleus (GO:0016973)","1/21",0.359765577709914,0.646889243074437,0,0,2.33412887828162,2.38618609724726,"THOC2"
"Positive Regulation Of Amyloid Precursor Protein Catabolic Process (GO:1902993)","1/21",0.359765577709914,0.646889243074437,0,0,2.33412887828162,2.38618609724726,"ABCG1"
"Positive Regulation Of Transcription Regulatory Region DNA Binding (GO:2000679)","1/21",0.359765577709914,0.646889243074437,0,0,2.33412887828162,2.38618609724726,"NEUROD1"
"Purine Nucleotide Biosynthetic Process (GO:0006164)","1/21",0.359765577709914,0.646889243074437,0,0,2.33412887828162,2.38618609724726,"NADSYN1"
