"Term","Overlap","P.value","Adjusted.P.value","Old.P.value","Old.Adjusted.P.value","Odds.Ratio","Combined.Score","Genes"
"Regulation Of Type II Interferon Production (GO:0032649)","2/87",0.548249947721473,0.737884335813676,0,0,1.09738249366732,0.659553201651189,"IFNL1;INHA"
"Potassium Ion Transmembrane Transport (GO:0071805)","3/137",0.551558089684545,0.737884335813676,0,0,1.04402448190701,0.621203039506732,"KCNK6;LRRC26;KCNS3"
"Amino Acid Catabolic Process (GO:0009063)","1/38",0.553917546786319,0.737884335813676,0,0,1.26059472360188,0.744683015827299,"BCKDHB"
"Regulation Of Neurotransmitter Secretion (GO:0046928)","1/38",0.553917546786319,0.737884335813676,0,0,1.26059472360188,0.744683015827299,"PNKD"
"Response To cAMP (GO:0051591)","1/38",0.553917546786319,0.737884335813676,0,0,1.26059472360188,0.744683015827299,"DGKQ"
"Connective Tissue Development (GO:0061448)","1/38",0.553917546786319,0.737884335813676,0,0,1.26059472360188,0.744683015827299,"ZNF516"
"Response To Peptide (GO:1901652)","1/38",0.553917546786319,0.737884335813676,0,0,1.26059472360188,0.744683015827299,"IRS1"
"Establishment Of Protein Localization To Plasma Membrane (GO:0061951)","1/38",0.553917546786319,0.737884335813676,0,0,1.26059472360188,0.744683015827299,"RAB26"
"Fatty Acid Transport (GO:0015908)","1/38",0.553917546786319,0.737884335813676,0,0,1.26059472360188,0.744683015827299,"CPT1B"
"Import Into Cell (GO:0098657)","1/38",0.553917546786319,0.737884335813676,0,0,1.26059472360188,0.744683015827299,"SLC46A1"
"Lymphocyte Proliferation (GO:0046651)","1/38",0.553917546786319,0.737884335813676,0,0,1.26059472360188,0.744683015827299,"LMBR1L"
"mRNA Transcription By RNA Polymerase II (GO:0042789)","1/38",0.553917546786319,0.737884335813676,0,0,1.26059472360188,0.744683015827299,"TAF4"
"Membrane Fission (GO:0090148)","1/38",0.553917546786319,0.737884335813676,0,0,1.26059472360188,0.744683015827299,"STAM2"
"Positive Regulation Of Axonogenesis (GO:0050772)","1/38",0.553917546786319,0.737884335813676,0,0,1.26059472360188,0.744683015827299,"MAPT"
"Positive Regulation Of Cation Channel Activity (GO:2001259)","1/38",0.553917546786319,0.737884335813676,0,0,1.26059472360188,0.744683015827299,"LRRC26"
"Positive Regulation Of Protein Tyrosine Kinase Activity (GO:0061098)","1/38",0.553917546786319,0.737884335813676,0,0,1.26059472360188,0.744683015827299,"SRCIN1"
"Negative Regulation Of Neuron Death (GO:1901215)","2/88",0.554448508647889,0.738054091933762,0,0,1.0845665961945,0.639657137573682,"SIX4;TGFB3"
"Cellular Response To Chemical Stress (GO:0062197)","2/89",0.560586699200329,0.740144642766003,0,0,1.07204531705439,0.620469133144567,"TBC1D24;CPEB2"
"Organic Anion Transport (GO:0015711)","2/89",0.560586699200329,0.740144642766003,0,0,1.07204531705439,0.620469133144567,"SLC35A1;SLC44A4"
"Positive Regulation Of DNA Repair (GO:0045739)","2/89",0.560586699200329,0.740144642766003,0,0,1.07204531705439,0.620469133144567,"UIMC1;NPAS2"
"Negative Regulation Of Gene Expression (GO:0010629)","7/336",0.561566946307599,0.740144642766003,0,0,0.991757251043223,0.572268017975135,"TIPARP;DGKQ;METTL3;TRIM3;MAPT;ESR1;FOXP1"
"Regulation Of Mitochondrial Membrane Potential (GO:0051881)","1/39",0.563303085145039,0.740144642766003,0,0,1.22735837206381,0.704426941887903,"MAPT"
"Anterograde Axonal Transport (GO:0008089)","1/39",0.563303085145039,0.740144642766003,0,0,1.22735837206381,0.704426941887903,"KIF3A"
"Regulation Of Monoatomic Cation Transmembrane Transport (GO:1904062)","1/39",0.563303085145039,0.740144642766003,0,0,1.22735837206381,0.704426941887903,"NEDD4L"
"Carboxylic Acid Transmembrane Transport (GO:1905039)","1/39",0.563303085145039,0.740144642766003,0,0,1.22735837206381,0.704426941887903,"SLC46A1"
"Histone H4 Acetylation (GO:0043967)","1/39",0.563303085145039,0.740144642766003,0,0,1.22735837206381,0.704426941887903,"ING5"
"Internal Peptidyl-Lysine Acetylation (GO:0018393)","1/39",0.563303085145039,0.740144642766003,0,0,1.22735837206381,0.704426941887903,"KAT2A"
"Negative Regulation Of Cell-Substrate Adhesion (GO:0010812)","1/39",0.563303085145039,0.740144642766003,0,0,1.22735837206381,0.704426941887903,"FZD4"
"Negative Regulation Of Mitochondrion Organization (GO:0010823)","1/39",0.563303085145039,0.740144642766003,0,0,1.22735837206381,0.704426941887903,"MAPT"
"Nuclear-Transcribed mRNA Catabolic Process, Deadenylation-Dependent Decay (GO:0000288)","1/39",0.563303085145039,0.740144642766003,0,0,1.22735837206381,0.704426941887903,"TUT7"
"Odontogenesis (GO:0042476)","1/39",0.563303085145039,0.740144642766003,0,0,1.22735837206381,0.704426941887903,"TGFB3"
"Organelle Transport Along Microtubule (GO:0072384)","1/39",0.563303085145039,0.740144642766003,0,0,1.22735837206381,0.704426941887903,"MAPT"
"Positive Regulation Of Intracellular Transport (GO:0032388)","1/39",0.563303085145039,0.740144642766003,0,0,1.22735837206381,0.704426941887903,"PCNT"
"Positive Regulation Of Lymphocyte Differentiation (GO:0045621)","1/39",0.563303085145039,0.740144642766003,0,0,1.22735837206381,0.704426941887903,"RHOH"
"Positive Regulation Of Pattern Recognition Receptor Signaling Pathway (GO:0062208)","1/39",0.563303085145039,0.740144642766003,0,0,1.22735837206381,0.704426941887903,"TRIM3"
"Regulation Of Phosphatidylinositol 3-Kinase Signaling (GO:0014066)","2/90",0.566664315852984,0.744026585567199,0,0,1.05980861244019,0.601958771402895,"LIME1;FGFR1"
"Positive Regulation Of Multicellular Organismal Process (GO:0051240)","8/387",0.567764999889401,0.744444845039648,0,0,0.983733381151216,0.556839996625245,"KAT2A;PRKCH;SIX4;TGFB3;CARD9;ZNF516;TAPT1;GADD45G"
"Regulation Of Cytosolic Calcium Ion Concentration (GO:0051480)","1/40",0.572491612122497,0.744444845039648,0,0,1.19582644880974,0.666980805765622,"SLC8B1"
"L-alpha-amino Acid Transmembrane Transport (GO:1902475)","1/40",0.572491612122497,0.744444845039648,0,0,1.19582644880974,0.666980805765622,"SLC7A2"
"Regulation Of Microtubule Polymerization (GO:0031113)","1/40",0.572491612122497,0.744444845039648,0,0,1.19582644880974,0.666980805765622,"MAPT"
"Cellular Response To Heat (GO:0034605)","1/40",0.572491612122497,0.744444845039648,0,0,1.19582644880974,0.666980805765622,"MAPT"
"mRNA 3'-End Processing (GO:0031124)","1/40",0.572491612122497,0.744444845039648,0,0,1.19582644880974,0.666980805765622,"HEXIM1"
"Negative Regulation Of Protein Localization (GO:1903828)","1/40",0.572491612122497,0.744444845039648,0,0,1.19582644880974,0.666980805765622,"NEDD4L"
"Negative Regulation Of Secretion By Cell (GO:1903531)","1/40",0.572491612122497,0.744444845039648,0,0,1.19582644880974,0.666980805765622,"PNKD"
"Positive Regulation Of Insulin Secretion (GO:0032024)","1/40",0.572491612122497,0.744444845039648,0,0,1.19582644880974,0.666980805765622,"ANO1"
"Positive Regulation Of Myeloid Leukocyte Differentiation (GO:0002763)","1/40",0.572491612122497,0.744444845039648,0,0,1.19582644880974,0.666980805765622,"RIPK1"
"Protein Deacetylation (GO:0006476)","1/40",0.572491612122497,0.744444845039648,0,0,1.19582644880974,0.666980805765622,"SIRT3"
"Lymphocyte Differentiation (GO:0030098)","2/91",0.572681190251932,0.744444845039648,0,0,1.04784688995215,0.584097209562433,"LMBR1L;RHOH"
"rRNA Metabolic Process (GO:0016072)","2/91",0.572681190251932,0.744444845039648,0,0,1.04784688995215,0.584097209562433,"NOL8;MAPT"
"Regulation Of Actin Cytoskeleton Organization (GO:0032956)","2/91",0.572681190251932,0.744444845039648,0,0,1.04784688995215,0.584097209562433,"TAOK2;OR2A4"
"Transcription By RNA Polymerase II (GO:0006366)","4/192",0.575834678077744,0.746343990636011,0,0,0.991816693944354,0.547418026327473,"CTDP1;SNAPC2;TAF4;GTF2E1"
"Neuron Projection Development (GO:0031175)","4/192",0.575834678077744,0.746343990636011,0,0,0.991816693944354,0.547418026327473,"NEUROD1;TBC1D24;STMND1;MAPT"
"Protein Localization To Membrane (GO:0072657)","4/192",0.575834678077744,0.746343990636011,0,0,0.991816693944354,0.547418026327473,"ANO1;RAB3A;LIN7A;RAPGEF6"
"Protein Localization To Cell Periphery (GO:1990778)","3/142",0.575893992091079,0.746343990636011,0,0,1.00621085865121,0.555259025275951,"RAB3A;LIN7A;RAPGEF6"
"Regulation Of Chemokine Production (GO:0032642)","1/41",0.581487253502633,0.746343990636011,0,0,1.16587112171838,0.632095947572529,"FOXP1"
"DNA Duplex Unwinding (GO:0032508)","1/41",0.581487253502633,0.746343990636011,0,0,1.16587112171838,0.632095947572529,"PURA"
"Regulation Of Dendrite Development (GO:0050773)","1/41",0.581487253502633,0.746343990636011,0,0,1.16587112171838,0.632095947572529,"NEDD4L"
"Acylglycerol Metabolic Process (GO:0006639)","1/41",0.581487253502633,0.746343990636011,0,0,1.16587112171838,0.632095947572529,"DGKQ"
"Regulation Of Microtubule-Based Process (GO:0032886)","1/41",0.581487253502633,0.746343990636011,0,0,1.16587112171838,0.632095947572529,"MAPT"
"Regulation Of Release Of Cytochrome C From Mitochondria (GO:0090199)","1/41",0.581487253502633,0.746343990636011,0,0,1.16587112171838,0.632095947572529,"MOAP1"
"Response To Amino Acid Starvation (GO:1990928)","1/41",0.581487253502633,0.746343990636011,0,0,1.16587112171838,0.632095947572529,"RNF152"
"Detection Of Chemical Stimulus Involved In Sensory Perception Of Bitter Taste (GO:0001580)","1/41",0.581487253502633,0.746343990636011,0,0,1.16587112171838,0.632095947572529,"PIP"
"Double-Strand Break Repair Via Nonhomologous End Joining (GO:0006303)","1/41",0.581487253502633,0.746343990636011,0,0,1.16587112171838,0.632095947572529,"POLL"
"Synaptic Vesicle Exocytosis (GO:0016079)","1/41",0.581487253502633,0.746343990636011,0,0,1.16587112171838,0.632095947572529,"RAB3A"
"Negative Regulation Of mRNA Catabolic Process (GO:1902373)","1/41",0.581487253502633,0.746343990636011,0,0,1.16587112171838,0.632095947572529,"DHX34"
"Negative Regulation Of Proteolysis (GO:0045861)","1/41",0.581487253502633,0.746343990636011,0,0,1.16587112171838,0.632095947572529,"CLN8"
"Positive Regulation Of Viral Process (GO:0048524)","1/41",0.581487253502633,0.746343990636011,0,0,1.16587112171838,0.632095947572529,"TARBP2"
"Protein Localization To Lysosome (GO:0061462)","1/41",0.581487253502633,0.746343990636011,0,0,1.16587112171838,0.632095947572529,"ZFYVE16"
"Regulation Of Peptidyl-Serine Phosphorylation (GO:0033135)","2/93",0.584532205584477,0.749200703583748,0,0,1.02471212997529,0.550212415308732,"INPP5J;GPD1L"
"Positive Regulation Of Protein Kinase B Signaling (GO:0051897)","2/93",0.584532205584477,0.749200703583748,0,0,1.02471212997529,0.550212415308732,"GDF15;FGFR1"
"Actin Filament Organization (GO:0007015)","3/144",0.585394570133263,0.749780580373766,0,0,0.991836318179499,0.531097780236407,"SVIL;POF1B;PRSS8"
"Regulation Of Osteoclast Differentiation (GO:0045670)","1/42",0.590294048811898,0.750368123764139,0,0,1.13737703009488,0.599550647525448,"GPR137B"
"Cellular Response To Amino Acid Starvation (GO:0034198)","1/42",0.590294048811898,0.750368123764139,0,0,1.13737703009488,0.599550647525448,"RNF152"
"Sensory Perception Of Bitter Taste (GO:0050913)","1/42",0.590294048811898,0.750368123764139,0,0,1.13737703009488,0.599550647525448,"PIP"
"Stress-Activated MAPK Cascade (GO:0051403)","1/42",0.590294048811898,0.750368123764139,0,0,1.13737703009488,0.599550647525448,"TAOK2"
"Substantia Nigra Development (GO:0021762)","1/42",0.590294048811898,0.750368123764139,0,0,1.13737703009488,0.599550647525448,"POTEE"
"Keratinocyte Differentiation (GO:0030216)","1/42",0.590294048811898,0.750368123764139,0,0,1.13737703009488,0.599550647525448,"FGFR1"
"Lipid Modification (GO:0030258)","1/42",0.590294048811898,0.750368123764139,0,0,1.13737703009488,0.599550647525448,"DGKQ"
"Modulation By Host Of Symbiont Process (GO:0051851)","1/42",0.590294048811898,0.750368123764139,0,0,1.13737703009488,0.599550647525448,"CTDP1"
"Monoatomic Cation Transport (GO:0006812)","1/42",0.590294048811898,0.750368123764139,0,0,1.13737703009488,0.599550647525448,"ANO1"
"Positive Regulation Of Calcium Ion Transmembrane Transport (GO:1904427)","1/42",0.590294048811898,0.750368123764139,0,0,1.13737703009488,0.599550647525448,"PDPK1"
"Peptidyl-Lysine Modification (GO:0018205)","2/94",0.59036617282482,0.750368123764139,0,0,1.01352194716039,0.534138535198056,"MDM2;SIRT3"
"Positive Regulation Of Protein Metabolic Process (GO:0051247)","4/196",0.592136233321134,0.752095257461357,0,0,0.970953525641026,0.508797655438388,"TIPARP;METTL3;CARD9;FGFR4"
"Regulation Of Cold-Induced Thermogenesis (GO:0120161)","3/146",0.594758606304142,0.754419613442964,0,0,0.977863862755949,0.508097730073551,"ZNF516;LNPEP;GADD45G"
"Regulation Of Chromosome Organization (GO:0033044)","1/43",0.598915953372982,0.754419613442964,0,0,1.11023979997727,0.569146672147988,"MAPT"
"DNA-templated DNA Replication Maintenance Of Fidelity (GO:0045005)","1/43",0.598915953372982,0.754419613442964,0,0,1.11023979997727,0.569146672147988,"FAM111A"
"Regulation Of Endothelial Cell Apoptotic Process (GO:2000351)","1/43",0.598915953372982,0.754419613442964,0,0,1.11023979997727,0.569146672147988,"PDPK1"
"Regulation Of Filopodium Assembly (GO:0051489)","1/43",0.598915953372982,0.754419613442964,0,0,1.11023979997727,0.569146672147988,"TGFB3"
"Regulation Of Primary Metabolic Process (GO:0080090)","1/43",0.598915953372982,0.754419613442964,0,0,1.11023979997727,0.569146672147988,"FGFR4"
"Skeletal System Morphogenesis (GO:0048705)","1/43",0.598915953372982,0.754419613442964,0,0,1.11023979997727,0.569146672147988,"FGFR1"
"Intracellular Glucose Homeostasis (GO:0001678)","1/43",0.598915953372982,0.754419613442964,0,0,1.11023979997727,0.569146672147988,"FOXK1"
"Intracellular Steroid Hormone Receptor Signaling Pathway (GO:0030518)","1/43",0.598915953372982,0.754419613442964,0,0,1.11023979997727,0.569146672147988,"ESR1"
"mRNA Transcription (GO:0009299)","1/43",0.598915953372982,0.754419613442964,0,0,1.11023979997727,0.569146672147988,"TAF4"
"Positive Regulation Of Stress Fiber Assembly (GO:0051496)","1/43",0.598915953372982,0.754419613442964,0,0,1.11023979997727,0.569146672147988,"TGFB3"
"Regulation Of Cellular Component Size (GO:0032535)","1/43",0.598915953372982,0.754419613442964,0,0,1.11023979997727,0.569146672147988,"RAP1GAP2"
"Protein Glycosylation (GO:0006486)","3/147",0.599388900219137,0.754495731934482,0,0,0.971023181454836,0.497013013097128,"FUT8;MGAT4A;ALG12"
"Cellular Response To Transforming Growth Factor Beta Stimulus (GO:0071560)","2/96",0.601850817708358,0.757073690225988,0,0,0.991855848518783,0.503610517804049,"GDF15;TGFB3"
"DNA-templated Transcription (GO:0006351)","4/199",0.60411755427711,0.7579264926305,0,0,0.955867850098619,0.481744467092449,"POLR3GL;SNAPC2;TAF4;GTF2E1"
"Autophagosome Maturation (GO:0097352)","1/44",0.607356839606188,0.7579264926305,0,0,1.08436476660931,0.540706331353737,"VPS16"
"Regulation Of Viral Entry Into Host Cell (GO:0046596)","1/44",0.607356839606188,0.7579264926305,0,0,1.08436476660931,0.540706331353737,"TRIM62"
"Embryonic Organ Morphogenesis (GO:0048562)","1/44",0.607356839606188,0.7579264926305,0,0,1.08436476660931,0.540706331353737,"NEUROD1"
"Synaptic Vesicle Recycling (GO:0036465)","1/44",0.607356839606188,0.7579264926305,0,0,1.08436476660931,0.540706331353737,"RAB3A"
"Negative Regulation Of Immune System Process (GO:0002683)","1/44",0.607356839606188,0.7579264926305,0,0,1.08436476660931,0.540706331353737,"BPIFB1"
"Phosphatidylinositol Phosphate Biosynthetic Process (GO:0046854)","1/44",0.607356839606188,0.7579264926305,0,0,1.08436476660931,0.540706331353737,"PIP4K2A"
"Positive Regulation Of Biosynthetic Process (GO:0009891)","1/44",0.607356839606188,0.7579264926305,0,0,1.08436476660931,0.540706331353737,"TGFB3"
"Positive Regulation Of Cytokine-Mediated Signaling Pathway (GO:0001961)","1/44",0.607356839606188,0.7579264926305,0,0,1.08436476660931,0.540706331353737,"RIPK1"
"Regulation Of DNA Recombination (GO:0000018)","1/44",0.607356839606188,0.7579264926305,0,0,1.08436476660931,0.540706331353737,"RPA2"
"Regulation Of Cell-Substrate Adhesion (GO:0010810)","1/44",0.607356839606188,0.7579264926305,0,0,1.08436476660931,0.540706331353737,"FZD4"
"Regulation Of Defense Response (GO:0031347)","2/97",0.607501497100226,0.7579264926305,0,0,0.981364895492319,0.489112891405896,"TKFC;FOXP1"
"protein-RNA Complex Assembly (GO:0022618)","3/150",0.613070726613985,0.762300251888176,0,0,0.951059560514853,0.465329639712458,"HEXIM1;PPAN;TARBP2"
"MAPK Cascade (GO:0000165)","2/98",0.613091126586936,0.762300251888176,0,0,0.971092503987241,0.47509894493028,"TAOK2;FGFR1"
"Negative Regulation Of Macromolecule Biosynthetic Process (GO:0010558)","2/98",0.613091126586936,0.762300251888176,0,0,0.971092503987241,0.47509894493028,"DACH1;TRIM3"
"Phosphatidylinositol Biosynthetic Process (GO:0006661)","2/98",0.613091126586936,0.762300251888176,0,0,0.971092503987241,0.47509894493028,"PITPNM1;INPP5J"
"Positive Regulation Of Cold-Induced Thermogenesis (GO:0120162)","2/98",0.613091126586936,0.762300251888176,0,0,0.971092503987241,0.47509894493028,"ZNF516;GADD45G"
"Regulation Of Protein Modification Process (GO:0031399)","1/45",0.615620499173019,0.762335743390285,0,0,1.05966587112172,0.514069958623632,"SPRED2"
"Detection Of Chemical Stimulus Involved In Sensory Perception Of Taste (GO:0050912)","1/45",0.615620499173019,0.762335743390285,0,0,1.05966587112172,0.514069958623632,"PIP"
"Epidermal Growth Factor Receptor Signaling Pathway (GO:0007173)","1/45",0.615620499173019,0.762335743390285,0,0,1.05966587112172,0.514069958623632,"PDPK1"
"Organic Hydroxy Compound Transport (GO:0015850)","1/45",0.615620499173019,0.762335743390285,0,0,1.05966587112172,0.514069958623632,"ABCC3"
"Positive Regulation Of Innate Immune Response (GO:0045089)","1/45",0.615620499173019,0.762335743390285,0,0,1.05966587112172,0.514069958623632,"TRIM62"
"Regulation Of Apoptotic Signaling Pathway (GO:2001233)","1/45",0.615620499173019,0.762335743390285,0,0,1.05966587112172,0.514069958623632,"ING5"
"B Cell Receptor Signaling Pathway (GO:0050853)","1/46",0.6237106444882,0.765564105699149,0,0,1.03606470432246,0.489093748044111,"LIME1"
"Regulation Of Epidermal Growth Factor Receptor Signaling Pathway (GO:0042058)","1/46",0.6237106444882,0.765564105699149,0,0,1.03606470432246,0.489093748044111,"PTK6"
"Amino Acid Transport (GO:0006865)","1/46",0.6237106444882,0.765564105699149,0,0,1.03606470432246,0.489093748044111,"SLC7A2"
"Antiviral Innate Immune Response (GO:0140374)","1/46",0.6237106444882,0.765564105699149,0,0,1.03606470432246,0.489093748044111,"ZDHHC11"
"Regulation Of Nervous System Development (GO:0051960)","1/46",0.6237106444882,0.765564105699149,0,0,1.03606470432246,0.489093748044111,"ASCL2"
"Replication Fork Processing (GO:0031297)","1/46",0.6237106444882,0.765564105699149,0,0,1.03606470432246,0.489093748044111,"FAM111A"
"Response To Glucose (GO:0009749)","1/46",0.6237106444882,0.765564105699149,0,0,1.03606470432246,0.489093748044111,"NEUROD1"
"Response To Hydrogen Peroxide (GO:0042542)","1/46",0.6237106444882,0.765564105699149,0,0,1.03606470432246,0.489093748044111,"RIPK1"
"Development Of Primary Male Sexual Characteristics (GO:0046546)","1/46",0.6237106444882,0.765564105699149,0,0,1.03606470432246,0.489093748044111,"SIX4"
"Male Gonad Development (GO:0008584)","1/46",0.6237106444882,0.765564105699149,0,0,1.03606470432246,0.489093748044111,"SIX4"
"Negative Regulation Of Cellular Metabolic Process (GO:0031324)","1/46",0.6237106444882,0.765564105699149,0,0,1.03606470432246,0.489093748044111,"CIDEC"
"Negative Regulation Of Cold-Induced Thermogenesis (GO:0120163)","1/46",0.6237106444882,0.765564105699149,0,0,1.03606470432246,0.489093748044111,"LNPEP"
"Protein Sumoylation (GO:0016925)","1/46",0.6237106444882,0.765564105699149,0,0,1.03606470432246,0.489093748044111,"MDM2"
"Protein Complex Oligomerization (GO:0051259)","2/100",0.624087524110132,0.765564105699149,0,0,0.951176642905966,0.44844617012366,"CARD9;IKZF4"
"rRNA Processing (GO:0006364)","2/101",0.629494495302427,0.770682411616094,0,0,0.941520467836257,0.435771610436827,"NOL8;RRP15"
"Golgi To Plasma Membrane Transport (GO:0006893)","1/47",0.631630910340363,0.770682411616094,0,0,1.01348967521013,0.465647890115709,"RAB26"
"Cognition (GO:0050890)","1/47",0.631630910340363,0.770682411616094,0,0,1.01348967521013,0.465647890115709,"LINS1"
"Response To Organonitrogen Compound (GO:0010243)","1/47",0.631630910340363,0.770682411616094,0,0,1.01348967521013,0.465647890115709,"HLCS"
"Insulin Receptor Signaling Pathway (GO:0008286)","1/47",0.631630910340363,0.770682411616094,0,0,1.01348967521013,0.465647890115709,"IRS1"
"Positive Regulation Of Epithelial To Mesenchymal Transition (GO:0010718)","1/47",0.631630910340363,0.770682411616094,0,0,1.01348967521013,0.465647890115709,"TGFB3"
"Positive Regulation Of Smooth Muscle Cell Proliferation (GO:0048661)","1/47",0.631630910340363,0.770682411616094,0,0,1.01348967521013,0.465647890115709,"FOXP1"
"Protein Monoubiquitination (GO:0006513)","1/47",0.631630910340363,0.770682411616094,0,0,1.01348967521013,0.465647890115709,"UBE2O"
"Regulation Of RNA Splicing (GO:0043484)","2/102",0.634840821065814,0.773766511333968,0,0,0.932057416267943,0.423509168745153,"KAT2A;AKAP17A"
"Negative Regulation Of Cell Differentiation (GO:0045596)","4/207",0.635004665671015,0.773766511333968,0,0,0.917819249715801,0.416802769280451,"SPRED2;TRIB3;ABCG1;TBX3"
"Cellular Response To Radiation (GO:0071478)","1/48",0.639384855576831,0.776517198439591,0,0,0.991875285634489,0.443614959837767,"SWI5"
"Chloride Transmembrane Transport (GO:1902476)","1/48",0.639384855576831,0.776517198439591,0,0,0.991875285634489,0.443614959837767,"ANO7"
"Myelination (GO:0042552)","1/48",0.639384855576831,0.776517198439591,0,0,0.991875285634489,0.443614959837767,"ZNF24"
"Negative Regulation Of ERK1 And ERK2 Cascade (GO:0070373)","1/48",0.639384855576831,0.776517198439591,0,0,0.991875285634489,0.443614959837767,"SPRED2"
"Post-Translational Protein Modification (GO:0043687)","1/48",0.639384855576831,0.776517198439591,0,0,0.991875285634489,0.443614959837767,"HLCS"
"Autophagy Of Mitochondrion (GO:0000422)","1/49",0.646975964657254,0.780553456040974,0,0,0.971161495624503,0.42288851883524,"FBXL4"
"Erythrocyte Differentiation (GO:0030218)","1/49",0.646975964657254,0.780553456040974,0,0,0.971161495624503,0.42288851883524,"INHA"
"Fatty Acid Beta-Oxidation (GO:0006635)","1/49",0.646975964657254,0.780553456040974,0,0,0.971161495624503,0.42288851883524,"CRAT"
"Heterophilic Cell-Cell Adhesion Via Plasma Membrane Cell Adhesion Molecules (GO:0007157)","1/49",0.646975964657254,0.780553456040974,0,0,0.971161495624503,0.42288851883524,"IGSF21"
"Interferon-Mediated Signaling Pathway (GO:0140888)","1/49",0.646975964657254,0.780553456040974,0,0,0.971161495624503,0.42288851883524,"IFNL1"
"Negative Regulation Of DNA Metabolic Process (GO:0051053)","1/49",0.646975964657254,0.780553456040974,0,0,0.971161495624503,0.42288851883524,"DACH1"
"Negative Regulation Of T Cell Activation (GO:0050868)","1/49",0.646975964657254,0.780553456040974,0,0,0.971161495624503,0.42288851883524,"IFNL1"
"Positive Regulation Of Nervous System Development (GO:0051962)","1/49",0.646975964657254,0.780553456040974,0,0,0.971161495624503,0.42288851883524,"CLSTN2"
"Proton Transmembrane Transport (GO:1902600)","1/49",0.646975964657254,0.780553456040974,0,0,0.971161495624503,0.42288851883524,"SLC46A1"
"Regulation Of Cell Communication (GO:0010646)","1/49",0.646975964657254,0.780553456040974,0,0,0.971161495624503,0.42288851883524,"ITGB6"
"Intrinsic Apoptotic Signaling Pathway (GO:0097193)","2/105",0.650517588375443,0.784308944718976,0,0,0.904770753007851,0.389039610341537,"MOAP1;TRIB3"
"Regulation Of Interleukin-12 Production (GO:0032655)","1/50",0.654407649232302,0.786924122581118,0,0,0.95129316643125,0.403371899239018,"FOXP1"
"Regulation Of Mitochondrion Organization (GO:0010821)","1/50",0.654407649232302,0.786924122581118,0,0,0.95129316643125,0.403371899239018,"MAPT"
"Ribosome Assembly (GO:0042255)","1/50",0.654407649232302,0.786924122581118,0,0,0.95129316643125,0.403371899239018,"PPAN"
"Intracellular Iron Ion Homeostasis (GO:0006879)","1/50",0.654407649232302,0.786924122581118,0,0,0.95129316643125,0.403371899239018,"SLC46A1"
"Regulation Of Smoothened Signaling Pathway (GO:0008589)","1/51",0.6616832495609,0.79358600881763,0,0,0.932219570405728,0.384977142901946,"KCTD6"
"Regulation Of Synapse Assembly (GO:0051963)","1/51",0.6616832495609,0.79358600881763,0,0,0.932219570405728,0.384977142901946,"CLSTN2"
"Positive Regulation Of DNA Recombination (GO:0045911)","1/51",0.6616832495609,0.79358600881763,0,0,0.932219570405728,0.384977142901946,"KMT5C"
"Positive Regulation Of Actin Filament Bundle Assembly (GO:0032233)","1/51",0.6616832495609,0.79358600881763,0,0,0.932219570405728,0.384977142901946,"TGFB3"
"Response To Tumor Necrosis Factor (GO:0034612)","2/108",0.665655333536744,0.79730426001225,0,0,0.87902861785682,0.357749932187684,"RIPK1;AFF3"
"Positive Regulation Of Metabolic Process (GO:0009893)","2/108",0.665655333536744,0.79730426001225,0,0,0.87902861785682,0.357749932187684,"ZNF516;GADD45G"
"Chromatin Organization (GO:0006325)","5/268",0.666317132066699,0.797422581564894,0,0,0.884923725319529,0.35926978281663,"L3MBTL1;ING5;KAT2A;JARID2;ESR1"
"Positive Regulation Of Intracellular Signal Transduction (GO:1902533)","10/525",0.667429443771285,0.797422581564894,0,0,0.902912621359223,0.365067072576907,"HEXIM1;TRIM62;DOK3;GDF15;TGFB3;CARD9;TAOK2;TRAF5;RIPK1;FGFR1"
"Negative Regulation Of Cell Migration (GO:0030336)","3/163",0.668665221419391,0.797422581564894,0,0,0.873201438848921,0.3514389203799,"DACH1;MACIR;ARHGAP4"
"Cell Cycle G1/S Phase Transition (GO:0044843)","1/52",0.668806036151201,0.797422581564894,0,0,0.913893958538069,0.367624073037836,"CDK3"
"Neurotransmitter Transport (GO:0006836)","1/52",0.668806036151201,0.797422581564894,0,0,0.913893958538069,0.367624073037836,"LIN7A"
"Positive Regulation Of B Cell Activation (GO:0050871)","1/52",0.668806036151201,0.797422581564894,0,0,0.913893958538069,0.367624073037836,"KMT5C"
